{
  "envelope_id": "550e8400-e29b-41d4-a716-446655440001",
  "version": "1.0.0",
  "mode": "simulation",
  "risk_tier": 1,
  "mission_type": "red_team",
  "classification_level": "UNCLASS",
  "scope_id": "scope-external-pentest-001",
  "scope_hash": "sha256:a1b2c3d4e5f6789012345678901234567890abcdefabcdefabcdefabcdef1234",
  "approvals": [
    {
      "approver_id": "user-security-001",
      "approver_name": "Security Lead",
      "role": "Security",
      "timestamp": "2025-01-15T10:00:00Z",
      "signature": "BASE64_SIGNATURE_SECURITY",
      "scope_hash": "sha256:a1b2c3d4e5f6789012345678901234567890abcdefabcdefabcdefabcdef1234",
      "valid": true,
      "expiry": "2025-03-15T10:00:00Z"
    },
    {
      "approver_id": "user-product-001",
      "approver_name": "Product Owner",
      "role": "Product",
      "timestamp": "2025-01-15T11:00:00Z",
      "signature": "BASE64_SIGNATURE_PRODUCT",
      "scope_hash": "sha256:a1b2c3d4e5f6789012345678901234567890abcdefabcdefabcdefabcdef1234",
      "valid": true,
      "expiry": "2025-03-15T11:00:00Z"
    }
  ],
  "budget_cap": {
    "compute_hours": 100,
    "api_calls": 10000,
    "data_transfer_gb": 50,
    "cost_usd": 1000,
    "soft_limit_percentage": 80
  },
  "valid_from": "2025-01-15T00:00:00Z",
  "valid_to": "2025-03-15T23:59:59Z",
  "roe": {
    "allowed_assets": [
      "ext-web-01.example.com",
      "ext-web-02.example.com",
      "ext-api-01.example.com",
      "ext-mail-01.example.com"
    ],
    "disallowed_assets": [
      "internal-*",
      "*.internal.example.com",
      "prod-db-*"
    ],
    "allowed_networks": [
      "203.0.113.0/24"
    ],
    "allowed_tools": [
      "nmap",
      "nikto",
      "nuclei",
      "sqlmap",
      "burpsuite",
      "amass",
      "subfinder"
    ],
    "allowed_tool_categories": [
      "reconnaissance",
      "vulnerability_scan",
      "exploitation"
    ],
    "disallowed_tools": [
      "mimikatz",
      "cobalt_strike",
      "ransomware_sim"
    ],
    "time_restrictions": true,
    "allowed_hours": {
      "start": "09:00",
      "end": "17:00",
      "timezone": "UTC"
    },
    "alert_footprint_cap": 30,
    "blast_radius_cap": 50,
    "lateral_movement_authorized": false,
    "critical_systems_authorized": false,
    "destructive_ops_authorized": false,
    "data_exfiltration_authorized": false,
    "persistence_authorized": false
  },
  "constraints": {
    "max_concurrent_operations": 5,
    "max_attack_depth": 4,
    "require_human_approval_for": [],
    "simulation_runs_required": 100,
    "forensic_completeness_threshold": 0.90
  },
  "metadata": {
    "created_at": "2025-01-14T15:00:00Z",
    "created_by": "security-team",
    "description": "External perimeter penetration test - UNCLASS scope only",
    "tags": [
      "external",
      "pentest",
      "quarterly",
      "perimeter"
    ]
  }
}
